rank,word,reading_kana,reading_romaji,part_of_speech,meaning,labels,notes,example_1,example_2,example_3
51,窓口,まどぐち,madoguchi,Noun,ticket window; teller window; counter,jlpt_n2,,"いかず、眠れないという悩みの相談が多く寄せられる。

The insomnia telephone counseling service, which provides advice on sleep disorders over the phone, receives many calls from people who are having trouble falling asleep because they have concern that their jobs are not going well.","いる。

During the lunch break from 12:00 hrs to 13:00 hrs at city hall, staff members take turns tending the counter on a daily basis.","な顔で私を見た。

When I talked to a stranger to ask for directions, he (she) gave me a puzzled look."
52,毎度,まいど,maido,"Noun, Adverbial Noun",each time; always; often; thank you for your continued patronage​,jlpt_n2,,"のように妄想している。

Every time I think about winning 100 million yen in the lottery, I fantasize about buying a car and house, and taking an around the world trip on a cruise ship.","ご注文はオレンジジュースアイス付きでそうまいど

""Your order?"" ""Orange juice."" ""With ice?"" ""Yes."" ""Thanks for your business.""","毎度またいらっしゃい

Thanks, please come again."
53,真っ青,まっさお,massao,"Noun, Adjective, な-adjective",deep blue; bright blue​; ghastly pale; white as a sheet,jlpt_n2,,"は真っ青になった

All the colour went from Shoichi's face.","彼女を見たとたんに彼は真っ青になった

He turned pale the instant he saw her.","彼女はその知らせを聞いて真っ青になった

She turned pale at the news."
54,真っ白,まっしろ,masshiro,"Noun, Adjective, な-adjective",pure white; blank,jlpt_n2,,"山真っ白霧中入って車前後左右何も怖かった

I was driving in the mountains and suddenly found myself in a thick white fog. I was frightened because I couldn’t see anything in front of or behind the car, or to the left or right.","になった。

She got angry and slapped me hard on the cheek with a whack, and everything in front of my eyes blanked out.","目に見える限り野原は真っ白だった

The field was white as far as the eye could see."
55,名刺,めいし,meishi,Noun,business card,jlpt_n2,,"彼は名刺を出した

He presented his card.","これが私の名刺です

Here's my card.","私の名刺です追加情報があったらいつでも連絡下さいと記者は言った

""Here is my business card. Please call me anytime with more information,"" said the reporter."
56,店屋,みせや,miseya,Noun,store; shop,jlpt_n2,,,,
57,木材,もくざい,mokuzai,Noun,lumber; timber; wood,jlpt_n2,,"木材はアフリカの大半において消えゆく資源でありこれらのストーブは現在使われているものよりずっと木材の消費量が少ない

Wood is a disappearing resource in much of Africa, and these stoves burn far less wood than the stoves currently in much use.","紙は木材からできている

Paper is made from wood.","私たちは像を木材で作った

We made statues out of wood."
58,元々,もともと,motomoto,Adverb,"originally, by nature, from the start",jlpt_n2,,"服汚れるでしょそれはノープロブレムもともとあんまり綺麗じゃないし

""You'll get your clothes dirty."" ""No worries. They weren't very clean in the first place.""","彼らは西洋人がやってくる以前からもともと住んでいたニュージランド人なのです

They were the native New Zealanders before the Western people came.","彼らは元々あった文明を破壊した

They destroyed the native civilization."
59,内科,ないか,naika,Noun,internal medicine,jlpt_n2,,"と言われた。

When I went to see a physician because my fever would not subside, I was told that I had a summer cold.","が深い。

My doctor is an internist, but he is also well versed in Eastern medicine. After treating patients with chronic diseases for many years, he felt the limitations of Western medicine and started conducting research on Eastern medicine.","ひんぱんに吐血する場合は救急車を呼ぶか近くの内科医に往診してもらう

If you frequently spit-up blood you should call an ambulance or have a nearby physician make a house call."
60,並木,なみき,namiki,Noun,roadside tree; row of trees,jlpt_n2,,"のイチョウの木が並んでいる。

The ginkgo trees lining the outer garden of Meiji Shrine are famous, with 146 ginkgo trees in a row.","目前菜の花畑沿道桜並木織りなす黄色見事一言尽きる

The contrast of yellow and pink, spread out before me, created by the fields of rapeseed in flower and the rows of cherry blossoms along the road is nothing short of spectacular.","我々は背の高いポプラ並木を歩いた

We walked along an avenue of tall poplars."
61,入社,にゅうしゃ,nyuusha,"Noun, Verb, Suru verb",joining a company,jlpt_n2,,"新入社員山田君面頼りない

Mr. Yamada, a new employee, is young and energetic, but still a bit unreliable in terms of work.","のいない仕事を押しつけられてしまうことも多い。

My colleague has the kind of personality that makes it hard for him to say “no.” So, he is often forced to take on work which no one wants to do.","存在へと成長してくるものだ。

After a year with the company, the new employees’ initial refreshing naivety will be gone, and instead they will have grown into strong and reliable team members."
62,押さえる,おさえる,osaeru,"Verb, Ichidan verb, Transitive verb",to pin down; to hold down; to press down,jlpt_n2,,"の影響についても考えていかねばならない。

While it is essential to refrain from human contact and travel in order to control the spread of coronavirus, we must also consider the negative impact that such a restricted lifestyle may have on the mental state of individuals.","を積極的に消費していくことが必要だ。家庭でも、地域で

In order to promote domestic agriculture, it is necessary to actively consume domestically produced crops. Even at home, by purchasing “local vegetables” harvested in the area, costs can be reduced since there are no transportation expenses, and it also saves energy.","彼は回までシャットアウトに抑えた

He had a shutout until the ninth inning."
63,理科,りか,rika,Noun,science (department; course),jlpt_n2,,"の性質について学習する。

In elementary school, students learn about the nature of magnetic polarity in science.","に就職している。

Looking at the employment destinations of our university’s graduates by major, the majority of students who majored in science have found employment at IT-related companies.","彼は理科を科目とらなければならない

He has to take two science classes."
64,領収,りょうしゅう,ryoushuu,"Noun, Verb, Suru verb",receipt (of money); receiving,jlpt_n2,,"領収書をいただけますか

May I have a receipt?","領収書は必ず保管してください

Make sure you save the receipt.","領収書がほしいのですが

I'd like a receipt, please."
65,再三,さいさん,saisan,Adverb,again and again; repeatedly,jlpt_n2,,"の注意にもかかわらず、祖父は飲酒をやめようとしなかった。

Despite repeated warnings from his doctor, my grandfather refused to stop drinking.","し、会社をやめるまでに追い込まれてしまった。

My friend developed depression following repeated harassment by his supervisor at work; this drove him to leave the company.","申し上げてきましたように、今は格差解消が最優先するべき課題ではないのでしょうか。これについて総理のお考えをはっきりとお聞かせ願いたい。」と述べた。

An opposition Diet member said, “As I said repeatedly, I believe that eliminating the disparity is an issue of the highest priority now. I would like you to clearly state your views on this, Prime Minister.”"
66,刺さる,ささる,sasaru,"Verb, Godan verb, Intransitive verb",to stick into (with a sharp point); to prick; to get stuck (in);,jlpt_n2,,"矢はぐさりと刺さった

The arrow went home.","骨が喉にささった

The bone caught in my throat.","タイヤに釘が刺さっていた

We found a nail stuck in the tire."
67,刺身,さしみ,sashimi,Noun,"sashimi (raw sliced fish, shellfish or crustaceans)",jlpt_n2,,"のおつまみを作った。

When I made scallops into sashimi, the mantles were left over, so I sautéed them in butter and seasoned them with soy sauce, making a snack to go with sake.","がいい。

I can handle a whole range of alcoholic drinks, including beer and wine, but sake is definitely the way to go when eating sashimi (sliced raw fish).","黒鯛の料理方法刺し身黒鯛は何といっても刺身が一番おいしいです

How to prepare black porgy: Sashimi, Whatever anybody says sashimi is the tastiest."
68,早速,さっそく,sassoku,Adverb,at once; immediately; without delay; promptly,jlpt_n2,,"と思っている。

I received a message that my letter of recommendation for the scholarship was ready, so I am planning to visit my academic advisor without delay tomorrow.","でごみの削減を実践し始めた。

After learning about the SDGs (Sustainable Development Goals), elementary school students immediately began practicing waste reduction in their schools under the slogan “Reuse, Reduce, Recycle.”","作ってみたところ、なかなかおいしかった。

A dish using spring vegetables was shown on TV, so I tried it right away and the result was quite delicious."
69,刺す,さす,sasu,"Verb, Godan verb, Transitive verb",to pierce; to stab; to prick; to stick; to thrust; to sting,jlpt_n2,,"しまった。

I was stung by a bee and my hand became red and swollen.","かゆい。

The itch of the mosquito bite mark subsides, but the itchiness returns repeatedly.","海足海上がった

When I was swimming in the sea, I felt a tingling sensation of pain in my leg and thought I might have been stung by a jellyfish, so I got out of the water."
70,青少年,せいしょうねん,seishounen,Noun,youth; young person,jlpt_n2,,"彼は青少年向きの本をたくさん持っている

He has a lot of books for the young.","青少年の非行が急速に増加している

Juvenile delinquency is on the increase at a rapid pace.","私には青少年の心理がわからない

I can not understand the psychology of adolescents."
71,赤道,せきどう,sekidou,Noun,equator,jlpt_n2,,"にはない。しかし、ギニアに比べると

Equatorial Guinea, a country with “equatorial” in its name, is not located directly on the equator. However, the country is found in a location closer to the equator than Guinea.","ほぼ赤道直下にあるシンガポールでは雨季乾季があまり明瞭ではない

In Singapore, practically right on the equator, the rainy and dry seasons aren't very clear cut.","赤道における経度1度当たりの長さ

Distance per degree of longitude at equator."
72,社会科学,しゃかいかがく,shakaikagaku,Noun,social science,jlpt_n2,,"その大学の課程は自然科学と社会科学から成り立っている

That university's curriculum covers natural science and social science.",,
73,社説,しゃせつ,shasetsu,Noun,editorial; leading article; leader,jlpt_n2,,"中学校の国語の授業で、生徒たちはいくつかの新聞社の社説を読み比べ、その主張を比較した。

In a junior high school Japanese class students read, compared, and contrasted various arguments from different editorials of several newspapers.","今日の社説でそれを読んだ

I read it in today's edition.","今朝の新聞の社説を読みましたか

Have you read the leading article in today's paper?"
74,司会,しかい,shikai,"Noun, Verb, Suru verb",master of ceremonies; leading a meeting; presenter; host,jlpt_n2,,"。問題の読み上げもゲスト出演者との

My favorite female celebrity was appointed the host of a popular quiz show. She was so good at reading out the questions and talking wittily with the contestants that I soon became an even bigger fan of hers.","エジソンが言いました。""

On a quiz show, the host told the audience, “Edison, the inventor, said, ‘Genius is 1% inspiration and blah-blah-blah’.” Then, he stopped and posed the question: ""Now, what words go into where I said blah-blah-blah?”","務めた各チーム取り扱えなかった

I chaired today’s meeting, but I was unable to handle all the scheduled items on the agenda because the progress reports from each team in the project were slow."
75,新幹線,しんかんせん,shinkansen,Noun,Japanese bullet train,jlpt_n2,,"くらいで行ける。

The distance between Tokyo and Osaka is about 550 kilometers, but if you take the bullet train, the Shinkansen Nozomi, it only takes about two and a half hours.","を見て確認する。

Check the timetable for the arrival time of the next Shinkansen (bullet train) bound for Tokyo.","きたことも無視できない。

Japan’s period of rapid economic growth from the 1960s to the 1970s was a time of great events such as the Tokyo Olympics and the Osaka Expo. It was also a time characterized by vitality with the opening of the  Tōkaidō Shinkansen bullet train and the spread of ownership of television sets and automobiles. Despite all the positives, one negative aspect cannot be ignored: pollution became a serious problem."
76,白髪,しらが,shiraga,Noun,white hair; grey hair,jlpt_n2,,"父は白髪が混じってきた

My father is becoming gray.","父の髪は白髪交じりになった

My father's hair has become streaked with gray.","彼女の髪は白髪まじりだ

Her hair is streaked with gray."
77,自然科学,しぜんかがく,shizenkagaku,Noun,natural science,jlpt_n2,,"娘は言語や芸術よりも自然科学が好きです

My daughter prefers science to languages or art.","物理学は基本的な自然科学である

Physics is a fundamental natural science.","物理学は基礎的な自然科学である

Physics is a fundamental natural science."
78,書店,しょてん,shoten,Noun,bookshop; bookstore,jlpt_n2,,"を運ぶ必要はなくなる。

If you like a particular magazine, you can have it delivered to you by subscription, which enables you to avoid visiting a bookstore..","の経営を圧迫することになりかねない。

For retail stores that do not generate a large volume of sales, such as a privately owned bookstore or a stationery store, shoplifting and other forms of loss can severely impact the businesses’ viability. As such, it is worth remembering that shoplifting is a crime.","がある。

Go straight north from the station, turn right at the first crossroads, go a little farther, and the bookstore will be on your left."
79,商社,しょうしゃ,shousha,Noun,trading company; firm,jlpt_n2,,"があると言っていた。

A friend of mine who jot a job with a general trading company said that, after working in Japan for a few years, he would surely then be transferred to the overseas office.","と比べると高いといえる。

The annual income of a trading company’s employees varies by department, but it is generally higher than the average income of people within the same age group.","商社はアジアの新しい市場に目をつけています

Trade companies aim at a new market in Asia."
80,商店,しょうてん,shouten,Noun,shop; small store; business; firm,jlpt_n2,,"を変えた。

Redevelopment in front of the station has transformed the old shopping area into a large shopping mall.","いない。

Although the concept of redeveloping the area in front of the station has been in the planning stage for 10 years; it has not been realized due to the challenge of gaining the approval of the local shopping district.","は反対している。

The construction of a large new shopping mall could be the death knell for the local shopping district, and the shopkeepers are opposed to the development."
81,集合,しゅうごう,shuugou,"Noun, Verb, Suru verb",gathering; assembly; meeting,jlpt_n2,,"について、集合時間や見どころ、食事や見学時の注意なども含めて、詳しく説明してくれた。

The tour guide gave a detailed description of the itinerary of the day’s journey, including meeting times, highlights, and notes on meals and visits.","の予定だ。

For the bus trip tomorrow, we are scheduled to meet at Shinjuku Station at 9:00 a.m. and depart at 9:15 a.m.","した。

The pandemic prevented the opportunity to study abroad, which was disheartening."
82,習字,しゅうじ,shuuji,Noun,calligraphy; penmanship,jlpt_n2,,"いた。

When I was a child, I wanted to learn to write beautifully, so I attended a Japanese calligraphy class.",,
83,集会,しゅうかい,shuukai,"Noun, Verb, Suru verb",meeting; assembly; gathering; convention; rally,jlpt_n2,,"魔女集会で悪魔を召喚する

Her coven conjures the demons.","彼は集会で演説しなければならなかった

He had to address the meeting.","集会は時に解散した

The meeting broke up at seven."
84,速力,そくりょく,sokuryoku,Noun,speed,jlpt_n2,,"彼は全速力で走った

He ran as fast as his legs could carry him.","彼は全速力でドアの方へ向かった

He headed for the door at full speed.","待ちくたびれているか全速力で飛び出すかだ

Bored waiting or rushing off at full speed."
85,速達,そくたつ,sokutatsu,"Noun, Verb, Suru verb",express; special delivery,jlpt_n2,,"速達便でお願いします

Please send it by special delivery.","速達にしてくれませんか

Can you make it special delivery?","速達で送ってください

Please send it by express mail."
86,足袋,たび,tabi,Noun,Japanese socks (with split toe),jlpt_n2,,,,
87,足る,たる,taru,"Verb, Godan verb, Intransitive verb",to be sufficient; to be enough​; to be worth doing; to be worthy of; to deserve​,jlpt_n2,,"」など、うがったことを言っているのを読んで感心した。

I was impressed when I read in the newspaper’s letters to the editor section one by a junior high school student making insightful comments about the way people live, mentioning concepts like “being satisfied with one’s lot in life.”","と自分を比較してばかりいては幸せになれない。「

You cannot be happy if you are constantly comparing yourself to others. As the saying goes, “Be satisfied with your lot in life,” it is important to cherish what you have in the present moment and be thankful for it every day.","この校閲力の弱さは人手が足らないとしか考えられませんね

I can only put this poor checking down to lack of people at work."
88,特売,とくばい,tokubai,"Noun, Verb, Suru verb",special sale,jlpt_n2,,"毛皮のコートが特売中です

Fur coats are on sale.","今日はりんごが特売だった

Apples were on sale today.","きのうは和牛が特売だった

Japanese beef was on sale yesterday."
89,透明,とうめい,toumei,"Noun, Adjective, な-adjective",transparent; clear,jlpt_n2,,"に、浅い眠りと深い眠りを交互に繰り返している。

During a night’s sleep, a person alternates between shallow and deep sleep.","の上にビニールをかけてくれる。

When you shop at a department store on a rainy day, they put a plastic cover over the paper bags to keep the items you buy dry.","の高い海に分布している。

Coral reefs are distributed in shallow, clear waters in the tropics and subtropics."
90,東洋,とうよう,touyou,Noun,Orient,jlpt_n2,,"仏教に関するその記事は私に再び東洋の宗教に関する興味を呼び起こした

The article on Buddhism revived my interest in oriental religions.","が深い。

My doctor is an internist, but he is also well versed in Eastern medicine. After treating patients with chronic diseases for many years, he felt the limitations of Western medicine and started conducting research on Eastern medicine.","仏教に関するその記事が私の東洋の宗教への情熱を呼び戻した

The article on Buddhism revived my passion for Oriental religions."
91,売れ行き,うれゆき,ureyuki,Noun,sales; demand,jlpt_n2,,"季節限定のメニューだったが、好評につき、販売を継続することにした。

The menu was seasonal and available for only a limited time during the season, but due to its popularity the company decided to continue offering it.","がいい。

New bread products made with walnuts have been well received by customers, and they are selling fast every day.","への暴言は許されるものではない。

Regardless of whether you are drunk or not, verbal abuse of subordinates is not acceptable."
92,売上,うりあげ,uriage,Noun,amount sold; sales; proceeds; turnover,jlpt_n2,,"と、好調な伸びを示している。

Our new product was featured on a TV program, and we were inundated with enquiries, resulting in a 150% increase in sales this fiscal year compared to last year.","の経営を圧迫することになりかねない。

For retail stores that do not generate a large volume of sales, such as a privately owned bookstore or a stationery store, shoplifting and other forms of loss can severely impact the businesses’ viability. As such, it is worth remembering that shoplifting is a crime.","の目標について話し始めた。

The division manager opened the meeting by pointing out the details of last month’s sales slump, took a breath, and then began talking about the new goal for this month that we should aim for."
93,売り切れ,うりきれ,urikire,Noun,sold out,jlpt_n2,,"でがっかりした。

I had come a long way to buy the sweets that were featured on TV, but I was disappointed that they were already sold out.","切符はたちまち売り切れた

The tickets were sold out in a moment.","切符はすべて売り切れです

All the tickets are sold out."
94,売り切れる,うりきれる,urikireru,"Verb, Ichidan verb, Intransitive verb",to be sold out,jlpt_n2,,"切符はたちまち売り切れた

The tickets were sold out in a moment.","もう売り切れてしまったのですが次回有効券をお渡しいたします

It's out of stock, but I can give you a rain check.","それはすべて売り切れた

They were all sold out."
95,我が,わが,waga,Pre-noun adjectival,my; our; one's own,jlpt_n2,,"で夕食を作っている。

In our family, we have a meal rota: my husband and I take turns cooking dinner each day.","だろう。

By repeating consecutive losses, it is impossible for our team to be promoted to the higher-ranking league this year.","ため、社員や関係者に話を聞いてまわっているらしい。

I heard that a rival company is going around talking to employees and other concerned parties in order to figure out the inner workings of our company."
96,洋品店,ようひんてん,youhinten,Noun,shop that handles Western-style apparel and accessories,jlpt_n2,,,,
97,輸血,ゆけつ,yuketsu,"Noun, Verb, Suru verb",blood transfusion,jlpt_n2,,"輸血が必要です

A blood transfusion is necessary.",,
98,輸送,ゆそう,yusou,"Noun, Verb, Suru verb",transport; transportation,jlpt_n2,,"によって輸送する事業を海運業と言う。

The business of transporting passengers and cargo by ship is called shipping.","海運は長い歴史を持つ産業である。いつの時代でも、海外との貿易では、重い貨物は

Shipping is an industry with a long history. It has always been the case that heavy cargoes are always transported by ship when trading with foreign countries.","している。

In an effort to build a recycling-oriented society, the Tokyo Metropolitan Government encourages recycling."
99,材木,ざいもく,zaimoku,Noun,lumber; timber,jlpt_n2,,"が積まれている。

Lots of lumber is piled up at a housing construction site.","彼らは私達に材木を送ってくれるだろう

They will send us lumber.","彼は本箱を作るために材木を少し買っている

He is buying some wood so that he can make a bookcase."
